{
  "schemaVersion": 1,
  "version": "piagent-webui-workspace-tree-v1",
  "generatedAt": "2026-10-22T00:00:00.000Z",
  "identity": {
    "projectRef": "project_01",
    "runtimeInstanceId": "runtime_01",
    "sessionRef": "session_01",
    "taskId": null,
    "taskRunId": null,
    "agentOperationId": null,
    "toolCallId": null
  },
  "path": "",
  "entries": [
    {
      "name": "src",
      "path": "src",
      "kind": "directory",
      "protected": false,
      "readOnly": false,
      "ignored": false
    }
  ],
  "truncated": false,
  "source": "git"
}
